{
  "$schema": "https://json-schema.org/draft/2020-12/schema",
  "title": "Shipwright Conflict Verdict Packet",
  "type": "object",
  "additionalProperties": false,
  "required": [
    "winner",
    "margin",
    "rubric_scores",
    "dimension_rationales",
    "side_summaries",
    "decisive_dimension",
    "decisive_findings",
    "judge_confidence",
    "needs_human_review",
    "rationale"
  ],
  "properties": {
    "winner": { "type": "string", "enum": ["side_a", "side_b", "tie"] },
    "margin": { "type": "number" },
    "rubric_scores": {
      "type": "object",
      "additionalProperties": false,
      "required": ["side_a", "side_b"],
      "properties": {
        "side_a": {
          "type": "object",
          "additionalProperties": false,
          "required": [
            "claim_quality",
            "evidence_discipline",
            "responsiveness_to_critique",
            "internal_consistency",
            "decision_usefulness",
            "weighted_total"
          ],
          "properties": {
            "claim_quality": { "type": "number" },
            "evidence_discipline": { "type": "number" },
            "responsiveness_to_critique": { "type": "number" },
            "internal_consistency": { "type": "number" },
            "decision_usefulness": { "type": "number" },
            "weighted_total": { "type": "number", "minimum": 1, "maximum": 5 }
          }
        },
        "side_b": {
          "type": "object",
          "additionalProperties": false,
          "required": [
            "claim_quality",
            "evidence_discipline",
            "responsiveness_to_critique",
            "internal_consistency",
            "decision_usefulness",
            "weighted_total"
          ],
          "properties": {
            "claim_quality": { "type": "number" },
            "evidence_discipline": { "type": "number" },
            "responsiveness_to_critique": { "type": "number" },
            "internal_consistency": { "type": "number" },
            "decision_usefulness": { "type": "number" },
            "weighted_total": { "type": "number", "minimum": 1, "maximum": 5 }
          }
        }
      }
    },
    "dimension_rationales": {
      "type": "object",
      "additionalProperties": false,
      "required": [
        "claim_quality",
        "evidence_discipline",
        "responsiveness_to_critique",
        "internal_consistency",
        "decision_usefulness"
      ],
      "properties": {
        "claim_quality": { "type": "string", "minLength": 1 },
        "evidence_discipline": { "type": "string", "minLength": 1 },
        "responsiveness_to_critique": { "type": "string", "minLength": 1 },
        "internal_consistency": { "type": "string", "minLength": 1 },
        "decision_usefulness": { "type": "string", "minLength": 1 }
      }
    },
    "side_summaries": {
      "type": "object",
      "additionalProperties": false,
      "required": ["side_a", "side_b"],
      "properties": {
        "side_a": {
          "type": "object",
          "additionalProperties": false,
          "required": ["strengths", "weaknesses"],
          "properties": {
            "strengths": {
              "type": "array",
              "minItems": 1,
              "items": { "type": "string", "minLength": 1 }
            },
            "weaknesses": {
              "type": "array",
              "minItems": 1,
              "items": { "type": "string", "minLength": 1 }
            }
          }
        },
        "side_b": {
          "type": "object",
          "additionalProperties": false,
          "required": ["strengths", "weaknesses"],
          "properties": {
            "strengths": {
              "type": "array",
              "minItems": 1,
              "items": { "type": "string", "minLength": 1 }
            },
            "weaknesses": {
              "type": "array",
              "minItems": 1,
              "items": { "type": "string", "minLength": 1 }
            }
          }
        }
      }
    },
    "decisive_findings": {
      "type": "array",
      "minItems": 1,
      "items": { "type": "string", "minLength": 1 }
    },
    "decisive_dimension": {
      "type": "string",
      "enum": [
        "claim_quality",
        "evidence_discipline",
        "responsiveness_to_critique",
        "internal_consistency",
        "decision_usefulness"
      ]
    },
    "judge_confidence": { "type": "string", "enum": ["high", "medium", "low"] },
    "needs_human_review": { "type": "boolean" },
    "uncertainty_drivers": {
      "type": "array",
      "minItems": 1,
      "items": { "type": "string", "minLength": 1 }
    },
    "disambiguation_questions": {
      "type": "array",
      "minItems": 1,
      "items": { "type": "string", "minLength": 1 }
    },
    "needed_evidence": {
      "type": "array",
      "minItems": 1,
      "items": { "type": "string", "minLength": 1 }
    },
    "recommended_next_artifact": { "type": "string", "minLength": 1 },
    "recommended_next_action": { "type": "string", "minLength": 1 },
    "can_resolve_with_more_evidence": { "type": "boolean" },
    "escalation_recommendation": { "type": "string", "minLength": 1 },
    "rationale": { "type": "string", "minLength": 1 }
  }
}
