{
  "winner": "tie",
  "margin": 0,
  "rubric_scores": {
    "side_a": {
      "claim_quality": 3,
      "evidence_discipline": 3,
      "responsiveness_to_critique": 4,
      "internal_consistency": 3,
      "decision_usefulness": 3,
      "weighted_total": 3
    },
    "side_b": {
      "claim_quality": 3,
      "evidence_discipline": 2,
      "responsiveness_to_critique": 4,
      "internal_consistency": 3,
      "decision_usefulness": 3,
      "weighted_total": 3
    }
  },
  "dimension_rationales": {
    "claim_quality": "Both sides present well-reasoned strategic arguments, but Side A's final version is more nuanced in acknowledging legal uncertainties, while Side B's initial claims were stronger than its evidence supported. Side A's claims about precedent contagion remain a strong strategic point.",
    "evidence_discipline": "Side A's final artifact demonstrates improved evidence discipline by explicitly identifying the lack of the full liability opinion as a critical blocking dependency and reframing its legal claims accordingly. Side B's initial artifact was criticized for making an expected-value assertion without quantified inputs, and while its final version acknowledges this, the core recommendation still relies on risk posture rather than quantified evidence.",
    "responsiveness_to_critique": "Both sides effectively incorporated critiques. Side A significantly revised its legal certainty claims based on the evidence gap and integrated the critique into its 'Next Artifact'. Side B revised its recommendation to acknowledge the lack of quantified evidence, shifting its posture from a definitive expected-value claim to a risk-based strategic adjustment.",
    "internal_consistency": "Both sides maintain reasonable internal consistency between their claims, rationales, and proposed next steps. Side A's integration of the liability opinion gap into its overall strategy is a positive. Side B's focus on risk posture aligns with its revised evidence discipline.",
    "decision_usefulness": "Both final artifacts provide a clear strategic direction and actionable next steps, though Side A's is more cautiously grounded in awaiting critical information. Side B's immediate push for a 'dual-track strategy' is proactive, but its justification is still somewhat abstract due to the acknowledged evidence gaps."
  },
  "side_summaries": {
    "side_a": {
      "strengths": [
        "Strong emphasis on strategic precedent contagion across different antitrust cases, a critical long-term consideration.",
        "Cautious and evidence-driven approach, correctly identifying the full liability opinion as a blocking dependency before finalizing the strategy."
      ],
      "weaknesses": [
        "Initial legal certainty claims were too strong given the evidence gaps.",
        "The final recommendation relies heavily on awaiting external legal analysis before full commitment to a specific remedy package."
      ]
    },
    "side_b": {
      "strengths": [
        "Proactive posture in preparing for structural remedies, acknowledging the evolving regulatory landscape.",
        "Focus on practical implementation steps and rapid modeling of options."
      ],
      "weaknesses": [
        "Initial recommendation lacked sufficient quantified evidence to support its expected-value claim.",
        "The strategic shift is based on risk posture rather than definitively proven enterprise value maximization."
      ]
    }
  },
  "decisive_dimension": "evidence_discipline",
  "decisive_findings": [
    "Side A's final artifact demonstrates superior evidence discipline by explicitly acknowledging and integrating the critical evidence gap (full liability opinion) into its strategy and next steps, thus grounding its recommendation more firmly in the available information. While Side B also addressed its critique, its core recommendation still relies on an unquantified risk assessment.",
    "Both sides had strong responsiveness to critique, but Side A's adjustment was more fundamental to its core legal argument's certainty."
  ],
  "judge_confidence": "medium",
  "needs_human_review": true,
  "rationale": "This conflict run resulted in a tie due to the high quality of both revised artifacts and the effective incorporation of critiques. Side A's final artifact demonstrates superior evidence discipline by correctly identifying and prioritizing the need to read the full liability opinion, which is a crucial blocking dependency for finalizing its strategy. This makes its recommendation more robustly grounded, despite the legal uncertainty. Side B's final artifact also improved significantly by acknowledging its initial lack of quantified evidence and reframing its recommendation around risk posture, which is a valid strategic consideration. However, Side A's approach of identifying and waiting for critical evidence before fully committing to a course of action is pragmatically more sound in this complex scenario, leading to a slightly higher judge confidence in its overall approach, despite both sides being highly competitive."
}
