{
  "winner": "side_b",
  "margin": 0.3,
  "rubric_scores": {
    "side_a": {
      "claim_quality": 3.5,
      "evidence_discipline": 3.5,
      "responsiveness_to_critique": 4,
      "internal_consistency": 3.5,
      "decision_usefulness": 3.5,
      "weighted_total": 3.6
    },
    "side_b": {
      "claim_quality": 4,
      "evidence_discipline": 4,
      "responsiveness_to_critique": 4,
      "internal_consistency": 4,
      "decision_usefulness": 3.5,
      "weighted_total": 3.9
    }
  },
  "dimension_rationales": {
    "claim_quality": "Side B makes sharper, better-calibrated claims. Its 'burden of proof on continuation' framing is more disciplined than Side A's multi-phase restructuring plan, which asserts streaming investment targets and store closure percentages beyond what the evidence supports. Side A's bridge metaphor is compelling but its specificity outpaces its evidence base.",
    "evidence_discipline": "Side B consistently stays within what the evidence can bear. It explicitly refuses to anchor on a near-term streaming rescue that Blockbuster has not demonstrated it can execute. Side A improved after critique by removing the unsupported 5/month cap, but still specifies streaming investment figures ($100-150M/year) and store closure ranges (15-20%) without supporting data, and its Phase 2-3 plans assume organizational capabilities not in evidence.",
    "responsiveness_to_critique": "Both sides handled critique well. Side A adopted the evidence-gap finding on exchange frequency, elevated usage analysis as a gating prerequisite, and removed unsupported specifics. Side B adopted the overreach finding by narrowing from 'kill entirely' to 'kill at current scale, retain narrow hybrid' and stopped leaning on a speculative streaming pivot. Both dispositions were genuine and improved the artifacts.",
    "internal_consistency": "Side B maintains a cleaner logic chain: the company cannot afford current burn, the burden of proof is on continuation, conserve capital and preserve optionality. Side A has a tension between acknowledging Blockbuster may lack time and resources while simultaneously proposing a complex three-phase transformation including streaming platform development — a capability the company has never demonstrated and which Side A's own risk assessment flags as potentially unfeasible.",
    "decision_usefulness": "Roughly equal. Side A provides more detailed action steps but several are speculative and contingent on data that does not yet exist. Side B offers a simpler, more executable near-term path with a clear 30-day management gate. Side A's recommended next artifact (cohort analysis) is more actionable than Side B's broader transition model request. Neither artifact gives the board a fully operationalized decision."
  },
  "side_summaries": {
    "side_a": {
      "strengths": [
        "Strong adaptation to critique: genuinely adopted the evidence gap on exchange frequency, elevated usage analysis as the gating prerequisite, and reframed restructuring specifics as contingent on data collection rather than assumed."
      ],
      "weaknesses": [
        "Multi-phase plan extends well beyond evidence base — streaming investment figures, store closure percentages, and Phase 2-3 execution assume organizational capabilities Blockbuster has never demonstrated, creating internal tension with the artifact's own risk assessment."
      ]
    },
    "side_b": {
      "strengths": [
        "Disciplined evidence calibration throughout: consistently frames the decision around what the balance sheet can support rather than speculative future capabilities, and explicitly avoids anchoring on a streaming pivot the company cannot yet execute."
      ],
      "weaknesses": [
        "Less actionable detail on what the narrower hybrid model should look like — the 'require management to prove within one operating cycle' framing defers the hard design work without providing the board much guidance on what success criteria to apply."
      ]
    }
  },
  "decisive_dimension": "evidence_discipline",
  "decisive_findings": [
    "Side B consistently stayed within the bounds of available evidence, while Side A's multi-phase plan specified streaming investment amounts, store closure ranges, and organizational transformation steps that the evidence record cannot support.",
    "Side B's refusal to anchor on a near-term streaming rescue — explicitly noting Blockbuster has no demonstrated digital capability — is more honest to the Q3 2007 decision context than Side A's assumption that freed capital can be productively deployed to streaming.",
    "Both sides converged substantially after critique, but Side B arrived at a more internally consistent position: kill current economics, preserve the asset, demand proof before reinvesting. Side A's position requires the board to believe Blockbuster can execute a complex multi-year transformation under severe financial constraints."
  ],
  "judge_confidence": "medium",
  "needs_human_review": false,
  "rationale": "Both artifacts are competent and both improved meaningfully through the critique round, converging toward similar positions (reduce Total Access burn, preserve some hybrid capability, don't bet on immediate streaming). Side B wins on a narrow margin because it maintains stricter evidence discipline throughout — its claims never outpace what the available data can support, its internal logic is cleaner, and its framing of the decision as a burden-of-proof question is more appropriate for a board facing acute balance-sheet constraints. Side A offers a richer action plan but that richness introduces speculative elements (streaming investment targets, store closure percentages, multi-phase transformation roadmap) that the evidence cannot substantiate and that create tension with the artifact's own acknowledged risks. The margin is modest because Side A's critique response was strong and its recommended next artifact (cohort usage analysis) is genuinely more actionable than Side B's broader request."
}
