{
  "winner": "side_a",
  "margin": 0.4,
  "rubric_scores": {
    "side_a": {
      "claim_quality": 4,
      "evidence_discipline": 4,
      "responsiveness_to_critique": 5,
      "internal_consistency": 4,
      "decision_usefulness": 4,
      "weighted_total": 4.2
    },
    "side_b": {
      "claim_quality": 4,
      "evidence_discipline": 3,
      "responsiveness_to_critique": 4,
      "internal_consistency": 4,
      "decision_usefulness": 4,
      "weighted_total": 3.8
    }
  },
  "dimension_rationales": {
    "claim_quality": "Both sides make structurally sound strategic claims — dual-path frameworks with explicit pass/fail gates. Neither side fabricates strategic conclusions; both correctly identify staged commitment as the defensible posture. Roughly equal at 4.",
    "evidence_discipline": "Side A converted all unsupported specifics (NRR, pilot cost, headcount) into clearly labeled template placeholders with an explicit disclaimer, fully separating illustrative values from evidenced facts. Side B partially corrected its conflation error but retains nominal 'ctx-1' citations with no specificity, leaving evidentiary grounding weaker.",
    "responsiveness_to_critique": "Side A's revision was structurally thorough: the unknowns table was rebuilt as a reusable template with row-level guidance, and the disclaimer was repeated at both the top and footer to prevent any reader from treating placeholders as real figures. Side B adopted the core conflation correction but the revision is less architecturally complete.",
    "internal_consistency": "Both sides maintain coherent internal logic across their revised artifacts. Neither introduces new contradictions in the revision phase. The five-condition framework in Side B and the template structure in Side A both hold together without internal gaps.",
    "decision_usefulness": "Both artifacts deliver actionable dual-path frameworks with explicit criteria for when to act decisively versus pursue bounded validation. The gap is methodological, not strategic — a practitioner could use either artifact. Roughly equal at 4."
  },
  "side_summaries": {
    "side_a": {
      "strengths": [
        "Converted all unsupported figures into clearly labeled placeholders with an explicit disclaimer, directly resolving the fabricated-figures critique.",
        "Rebuilt the unknowns table as a reusable template with row-level guidance, making the revision structurally durable rather than a one-off patch."
      ],
      "weaknesses": [
        "The dual-path framework, while well-structured, is not meaningfully differentiated from Side B's strategic conclusions — the edge is methodological, not in the quality of the underlying strategic insight."
      ]
    },
    "side_b": {
      "strengths": [
        "Correctly adopted finding-1 and repaired the conflation between case-packet sparsity and actual organizational evidence gaps — a substantively important correction.",
        "The five-condition framework for decisive action is concise and practically usable by a decision-maker."
      ],
      "weaknesses": [
        "Evidence citations remain generic ('ctx-1') with no specificity, and the revision does not structurally prevent a reader from treating asserted conditions as evidenced facts."
      ]
    }
  },
  "decisive_dimension": "evidence_discipline",
  "decisive_findings": [
    "Side A's revision converted all unsupported specifics (NRR, pilot cost, headcount figures) into clearly labeled template placeholders with an explicit disclaimer — a methodologically cleaner response to the evidence-discipline critique than Side B's partial adjustment.",
    "Side A's responsiveness to critique was more structurally thorough: the unknowns table was rebuilt as a reusable template with row-level guidance, and the disclaimer was repeated both at the top and in a footer, preventing any reader from treating illustrative values as evidenced facts.",
    "Side B improved its core conflation error (absence of evidence in the record ≠ absence of evidence in the company) but its evidence citations remain nominal ('ctx-1'), and the five-condition framework for decisive action, while useful, is not anchored to any stated reasoning basis beyond assertion.",
    "Both sides reach similar strategic conclusions (staged commitment with explicit gates) — the gap is methodological discipline in how they handle unsupported figures, not in strategic framing quality."
  ],
  "judge_confidence": "medium",
  "needs_human_review": false,
  "rationale": "Side A wins on evidence discipline and responsiveness to critique. Its revision cleanly separated the strategic framework from illustrative specifics by converting the unknowns table to a template and adding explicit placeholder warnings, directly addressing the fabricated-figures problem raised in finding-2. Side B adopted finding-1 and corrected the conflation between case-packet sparsity and actual organizational evidence gaps, but its evidence citations remain weak (generic 'ctx-1' references) and the revision, while substantively sound, is less methodologically disciplined than Side A's. On claim quality, internal consistency, and decision usefulness the two sides are roughly equal in the final artifacts — both deliver a dual-path framework (act decisively vs. bounded validation) with explicit pass/fail criteria. The margin of 0.4 on a 1-5 scale is meaningful and consistent across two separable dimensions, warranting a verdict for Side A at medium confidence."
}
