{
  "winner": "side_b",
  "margin": 0.2,
  "rubric_scores": {
    "side_a": {
      "claim_quality": 4,
      "evidence_discipline": 4,
      "responsiveness_to_critique": 4,
      "internal_consistency": 4,
      "decision_usefulness": 4,
      "weighted_total": 4
    },
    "side_b": {
      "claim_quality": 4,
      "evidence_discipline": 5,
      "responsiveness_to_critique": 5,
      "internal_consistency": 4,
      "decision_usefulness": 4,
      "weighted_total": 4.2
    }
  },
  "dimension_rationales": {
    "claim_quality": "Both sides made strong core claims that competitor parity alone does not justify a 10-week build. Side A offered a fuller operating frame, while Side B stated the decision rule more tightly.",
    "evidence_discipline": "Side B was stronger because it explicitly handled null-result and inconclusive-evidence cases, reducing the risk of overstating what a validation phase can prove. Side A improved materially but still leaned more on estimated discovery mechanics.",
    "responsiveness_to_critique": "Both sides adopted the critique, but Side B integrated the critique more directly into its core decision logic by adding an explicit default-to-no-build rule when evidence is absent or weak.",
    "internal_consistency": "Both artifacts were coherent and mostly internally consistent. Side A’s added process detail was useful but introduced more operational assumptions; Side B stayed narrower and cleaner.",
    "decision_usefulness": "Both are decision-useful and correctly recommend against immediate build approval. Side B is slightly stronger because it gives the clearest end-state logic for no-build, narrow-scope exploration, or full PRD, which better supports an actual gating decision."
  },
  "side_summaries": {
    "side_a": {
      "strengths": [
        "Provides a thorough readiness framework and practical discovery plan tied to the missing evidence."
      ],
      "weaknesses": [
        "Still carries more execution-detail assumptions than the record supports, which slightly weakens its evidence discipline."
      ]
    },
    "side_b": {
      "strengths": [
        "Translates the critique into a sharper decision rule with explicit handling for absent or inconclusive evidence."
      ],
      "weaknesses": [
        "Is less operationally detailed about how the evidence phase would be run and managed."
      ]
    }
  },
  "decisive_dimension": "evidence_discipline",
  "decisive_findings": [
    "Side B directly resolved the main critique by specifying that empty or weak evidence channels default to no-build now rather than open-ended further research.",
    "Side B kept the artifact tightly scoped to the actual decision gate, avoiding additional planning assumptions not supported by the scenario.",
    "Side A improved substantially but still depended more on assumed cross-functional execution details and timing estimates."
  ],
  "judge_confidence": "medium",
  "needs_human_review": false,
  "rationale": "Side B wins narrowly because both artifacts reach the right headline conclusion, but Side B is more disciplined about what can and cannot be inferred from the available record. Its revised artifact squarely addresses the critique by making null or inconclusive evidence decision-relevant instead of treating validation as inherently decisive. Side A remains strong, especially on structure and practical readiness framing, but it still embeds more operational assumptions than the scenario justifies. The result is a small but real advantage for Side B on evidence discipline and critique handling."
}
